<?xml version="1.0" encoding="UTF-8"?>
<!--Sample XML file generated by XMLSpy v2009 sp1 (http://www.altova.com)-->
<d3dModelFactoryConfig
        xmlns="http://www.openda.org"
        xsi:schemaLocation="http://www.openda.org http://schemas.openda.org/deltares/d3dModelFactoryConfig.xsd"
        xmlns:xsi="http://www.w3.org/2001/XMLSchema-instance">
	<dll>
		<binDir>../../../../../bin</binDir>
		<type>Win32_Ifort</type>
		<!--file>d3df_dll.dll</file!-->
        <file>flow2d3d_openda.dll</file>
	</dll>
	<model>
		<directory>./model</directory>
		<mdFile>Est1D.mdf</mdFile>
		<maxNumInstancesInMemory>64</maxNumInstancesInMemory>
	</model>
	<exchangeItems>
		<exchangeItem id="West Boundary" type="bound_hq" />
		<exchangeItem id="S1" type="waterlevel" />
		<exchangeItem id="S2" type="waterlevel" />
		<exchangeItem id="S3" type="waterlevel" />
		<exchangeItem id="S4" type="waterlevel" />
	</exchangeItems>
</d3dModelFactoryConfig>
