<?xml version="1.0" encoding="UTF-8"?>
<d3dModelFactoryConfig
        xmlns="http://www.openda.org"
        xsi:schemaLocation="http://www.openda.org http://schemas.openda.org/d3dModelFactoryConfig.xsd"
        xmlns:xsi="http://www.w3.org/2001/XMLSchema-instance">
	<dll>
		<binDir>../../../../bin</binDir>
		<type>Win32_Ifort</type>
		<!--file>d3df_dll.dll</file!-->
                <file>flow2d3d_openda.dll</file>
	</dll>
	<model>
		<directory>./model</directory>
		<mdFile>Sea2D.mdf</mdFile>
	</model>
	<exchangeItems>
		<exchangeItem id="West Boundary" type="bound_hq" />
		<exchangeItem id="S1" type="waterlevel" />
		<exchangeItem id="S2" type="waterlevel" />
		<exchangeItem id="S3" type="waterlevel" />
		<exchangeItem id="S4" type="waterlevel" />
	</exchangeItems>
</d3dModelFactoryConfig>
